{
  "$schema": "http://json-schema.org/draft-07/schema#",
  "title": "AdaOS Scenario Manifest",
  "type": "object",
  "additionalProperties": true,
  "properties": {
    "id": {
      "type": "string",
      "pattern": "^[a-z0-9_.-]+$",
      "description": "Stable scenario identifier (matches directory name and is used in SDK/manage APIs)."
    },
    "name": {
      "type": "string",
      "description": "Optional internal name; when omitted, `id` is used."
    },
    "title": {
      "type": "string",
      "description": "Human-readable scenario title for UIs and Builder workflows."
    },
    "type": {
      "type": "string",
      "description": "Scenario type, e.g. `desktop` for web desktop scenarios."
    },
    "version": {
      "type": "string",
      "pattern": "^(0|[1-9]\\d*)\\.(0|[1-9]\\d*)\\.(0|[1-9]\\d*)(?:[-+][0-9A-Za-z.-]+)?$"
    },
    "description": {
      "type": "string",
      "description": "Short English description of what the scenario does."
    },
    "llm_hints": {
      "$ref": "#/$defs/authoringHints",
      "description": "Builder-readable scenario capability hints for AI-assisted and human authoring workflows."
    },
    "nlu_hints": {
      "$ref": "#/$defs/authoringHints",
      "description": "Builder-readable NLU hints for scenario aliases, examples, slot schemas, entities, and owner routing."
    },
    "depends": {
      "type": "array",
      "description": "List of skills this scenario depends on (skill ids).",
      "items": { "type": "string" }
    },
    "runtime": {
      "type": "object",
      "description": "Typed runtime metadata for scenario orchestration and skill binding.",
      "additionalProperties": false,
      "properties": {
        "skills": {
          "type": "object",
          "additionalProperties": false,
          "properties": {
            "required": {
              "type": "array",
              "description": "Scenario-owned required skills. This supersedes legacy depends for new manifests.",
              "items": { "type": "string", "minLength": 1 }
            },
            "optional": {
              "type": "array",
              "description": "Optional skills that the scenario may use when present but must not require for installation.",
              "items": { "type": "string", "minLength": 1 }
            }
          }
        }
      }
    },
    "updated_at": {
      "type": "string",
      "description": "Optional ISO-8601 timestamp of the last manifest update."
    },

    "data_projections": {
      "description": "Optional data projection rules that map (scope, slot) pairs to storage backends (see adaos.services.scenario.projection_registry).",
      "type": "array",
      "items": {
        "type": "object",
        "additionalProperties": false,
        "properties": {
          "scope": { "type": "string" },
          "slot": { "type": "string" },
          "targets": {
            "type": "array",
            "items": {
              "type": "object",
              "additionalProperties": true,
              "properties": {
                "backend": {
                  "type": "string",
                  "enum": ["yjs", "kv", "sql"]
                },
                "webspace_id": { "type": "string" },
                "path": { "type": "string" },
                "table": { "type": "string" },
                "column": { "type": "string" }
              },
              "required": ["backend"]
            }
          }
        },
        "required": ["scope", "slot"]
      }
    },

    "trigger": {
      "description": "Optional scenario trigger configuration (manual, boot, timer, event).",
      "oneOf": [
        { "type": "string", "enum": ["manual", "boot", "timer", "event"] },
        {
          "type": "object",
          "additionalProperties": false,
          "properties": {
            "type": {
              "type": "string",
              "enum": ["manual", "boot", "timer", "event"]
            },
            "cron": { "type": "string" },
            "at": { "type": "string", "pattern": "^\\d{2}:\\d{2}(:\\d{2})?$" },
            "interval": { "$ref": "#/$defs/duration" },
            "event": { "$ref": "#/$defs/topic" },
            "filters": { "type": "object" }
          },
          "required": ["type"]
        }
      ]
    },

    "vars": {
      "type": "object",
      "description": "Initial variables/bag values available to scenario steps (resolved templates are supported).",
      "additionalProperties": { "$ref": "#/$defs/valueOrTemplate" }
    },

    "workflow": {
      "description": "Optional single governed workflow.json manifest reference or bounded legacy inline workflow accepted only for migration.",
      "oneOf": [
        { "$ref": "#/$defs/workflowManifest" },
        { "$ref": "#/$defs/legacyWorkflow" }
      ]
    },
    "conversational": {
      "$ref": "#/$defs/conversationalManifest",
      "description": "Optional git-versioned conversational package stored under conversational/manifest.yaml."
    },
    "prototype_runtime": {
      "$ref": "#/$defs/prototypeRuntime",
      "description": "Optional bounded executable Prototype artifacts. These files model disposable data, bindings, one conversational workflow slice, and representative states; they are not runtime implementation evidence."
    },

    "steps": {
      "description": "Optional low-level execution steps for ScenarioRuntime (CLI/SDK runner).",
      "type": "array",
      "items": { "$ref": "#/$defs/step" }
    },

    "ui": {
      "description": "UI definition for desktop/webspaces. For MVP this is a loosely-typed object that mirrors scenario.json['ui'] structure.",
      "type": "object",
      "additionalProperties": true,
      "properties": {
        "application": {
          "description": "Top-level application layout (e.g. desktop.pageSchema/modals).",
          "type": "object"
        },
        "catalog": {
          "description": "Optional catalog section (apps/widgets) for this scenario.",
          "type": "object"
        },
        "registry": {
          "description": "Optional registry section (modals/widgets).",
          "type": "object"
        },
        "data": {
          "description": "Scenario-level data seeds projected into YDoc.",
          "type": "object"
        }
      }
    },
    "nlu": {
      "description": "Optional scenario-level NLU intents, examples, and Builder hints.",
      "type": "object",
      "additionalProperties": true,
      "properties": {
        "llm_hints": { "$ref": "#/$defs/authoringHints" },
        "nlu_hints": { "$ref": "#/$defs/authoringHints" }
      }
    }
  },
  "required": ["id", "version"],

  "$defs": {
    "workflowManifest": {
      "type": "object",
      "required": ["manifest"],
      "properties": {
        "manifest": { "const": "workflow.json" }
      },
      "additionalProperties": false
    },
    "conversationalManifest": {
      "type": "object",
      "required": ["manifest"],
      "properties": {
        "manifest": { "const": "conversational/manifest.yaml" }
      },
      "additionalProperties": false
    },
    "prototypeRuntime": {
      "type": "object",
      "required": ["data", "binding", "workflow_slice", "representative_states"],
      "properties": {
        "data": { "$ref": "#/$defs/prototypeArtifactPath" },
        "binding": { "$ref": "#/$defs/prototypeArtifactPath" },
        "workflow_slice": { "$ref": "#/$defs/prototypeArtifactPath" },
        "representative_states": { "$ref": "#/$defs/prototypeArtifactPath" }
      },
      "additionalProperties": false
    },
    "prototypeArtifactPath": {
      "type": "string",
      "pattern": "^prototype/(?:[A-Za-z0-9_][A-Za-z0-9_.-]*/)*[A-Za-z0-9_][A-Za-z0-9_.-]*\\.json$"
    },
    "legacyWorkflow": {
      "type": "object",
      "additionalProperties": false,
      "properties": {
        "initial_state": { "type": "string" },
        "states": {
          "type": "object",
          "additionalProperties": { "$ref": "#/$defs/workflowState" }
        }
      }
    },
    "identifier": { "type": "string", "pattern": "^[A-Za-z_][A-Za-z0-9_]*$" },
    "authoringHints": {
      "type": "object",
      "additionalProperties": true,
      "properties": {
        "description": { "type": "string" },
        "aliases": {
          "type": "array",
          "items": { "type": "string", "minLength": 1 },
          "uniqueItems": true
        },
        "primary_actions": {
          "type": "array",
          "items": { "$ref": "#/$defs/authoringActionHint" }
        },
        "actions": {
          "type": "array",
          "items": { "$ref": "#/$defs/authoringActionHint" }
        },
        "examples": {
          "type": "array",
          "items": {
            "oneOf": [
              { "type": "string", "minLength": 1 },
              { "$ref": "#/$defs/authoringExample" }
            ]
          }
        },
        "slot_schemas": {
          "type": "object",
          "additionalProperties": true
        },
        "entities": {
          "type": "array",
          "items": {
            "oneOf": [
              { "type": "string", "minLength": 1 },
              { "$ref": "#/$defs/authoringEntityHint" }
            ]
          }
        },
        "owner_hints": {
          "type": "array",
          "items": { "type": "string", "minLength": 1 },
          "uniqueItems": true
        },
        "side_effect_class": {
          "type": "string",
          "enum": ["none", "read_only", "local_write", "runtime_write", "external_io", "destructive"]
        },
        "notes": { "type": "string" }
      }
    },
    "authoringActionHint": {
      "type": "object",
      "additionalProperties": true,
      "properties": {
        "id": { "type": "string", "minLength": 1 },
        "label": { "type": "string", "minLength": 1 },
        "description": { "type": "string" },
        "intent": { "type": "string", "minLength": 1 },
        "tool": { "type": "string", "minLength": 1 },
        "event": { "type": "string", "minLength": 1 },
        "slots": { "type": "object", "additionalProperties": true },
        "examples": {
          "type": "array",
          "items": { "type": "string", "minLength": 1 }
        },
        "side_effect_class": {
          "type": "string",
          "enum": ["none", "read_only", "local_write", "runtime_write", "external_io", "destructive"]
        }
      }
    },
    "authoringExample": {
      "type": "object",
      "additionalProperties": true,
      "properties": {
        "text": { "type": "string", "minLength": 1 },
        "locale": { "type": "string", "minLength": 1 },
        "intent": { "type": "string", "minLength": 1 },
        "slots": { "type": "object", "additionalProperties": true }
      },
      "required": ["text"]
    },
    "authoringEntityHint": {
      "type": "object",
      "additionalProperties": true,
      "properties": {
        "kind": { "type": "string", "minLength": 1 },
        "canonical_ref": { "type": "string", "minLength": 1 },
        "aliases": {
          "type": "array",
          "items": { "type": "string", "minLength": 1 }
        }
      }
    },
    "callPath": {
      "type": "string",
      "pattern": "^[A-Za-z_][\\w]*(\\.[A-Za-z_][\\w]*)*$"
    },
    "topic": {
      "type": "string",
      "pattern": "^[A-Za-z0-9_]+(\\.[A-Za-z0-9_]+)*$"
    },
    "duration": {
      "type": "string",
      "pattern": "^(\\d+)(ms|s|m|h|d)$",
      "examples": ["250ms", "3s", "20s", "5m", "2h", "1d"]
    },

    "value": {
      "description": "Plain YAML value (string, number, boolean, null, array or object).",
      "oneOf": [
        { "type": "string" },
        { "type": "number" },
        { "type": "integer" },
        { "type": "boolean" },
        { "type": "null" },
        { "type": "array", "items": { "$ref": "#/$defs/value" } },
        {
          "type": "object",
          "additionalProperties": { "$ref": "#/$defs/value" }
        }
      ]
    },

    "valueOrTemplate": {
      "description": "Literal value or template string using ${...} placeholders resolved against the scenario bag.",
      "oneOf": [
        { "$ref": "#/$defs/value" },
        { "type": "string", "pattern": ".*\\$\\{[^}]+\\}.*" }
      ]
    },

    "expr": {
      "description": "Expression string evaluated against the scenario bag (simple DSL used by ScenarioRuntime).",
      "type": "string",
      "minLength": 1
    },

    "argObject": {
      "type": "object",
      "additionalProperties": { "$ref": "#/$defs/valueOrTemplate" }
    },

    "setObject": {
      "type": "object",
      "minProperties": 1,
      "additionalProperties": { "$ref": "#/$defs/valueOrTemplate" }
    },

    "workflowAction": {
      "type": "object",
      "additionalProperties": false,
      "properties": {
        "id": {
          "description": "Workflow action identifier, used by IO layers when emitting scenario.workflow.action events.",
          "type": "string",
          "minLength": 1
        },
        "label": { "type": "string" },
        "trigger": {
          "description": "Preferred trigger kind for the action: button | voice | nlu | timer | skill.",
          "type": "string"
        },
        "tool": {
          "description": "Skill tool identifier to call in response to this action (e.g. prompt_engineer_skill.tz_execute).",
          "type": "string"
        },
        "params": {
          "type": "object",
          "additionalProperties": { "$ref": "#/$defs/valueOrTemplate" }
        },
        "next_state": {
          "description": "Workflow state id to transition to after this action completes; falls back to current state when omitted.",
          "type": "string"
        },
        "emit_event": {
          "description": "Optional event topic to emit when the action is taken (for external integrations).",
          "type": "string"
        }
      },
      "required": ["id"]
    },

    "workflowState": {
      "type": "object",
      "additionalProperties": false,
      "properties": {
        "label": { "type": "string" },
        "context": {
          "description": "Optional UI context hints for this workflow state (which fields are editable/readonly).",
          "type": "object",
          "additionalProperties": false,
          "properties": {
            "edit": {
              "type": "array",
              "items": { "type": "string" }
            },
            "readonly": {
              "type": "array",
              "items": { "type": "string" }
            }
          }
        },
        "actions": {
          "type": "array",
          "items": { "$ref": "#/$defs/workflowAction" }
        }
      }
    },

    "step": {
      "type": "object",
      "additionalProperties": false,
      "properties": {
        "name": { "$ref": "#/$defs/identifier" },

        "when": { "$ref": "#/$defs/expr" },

        "call": { "$ref": "#/$defs/callPath" },
        "args": { "$ref": "#/$defs/argObject" },
        "timeout": { "$ref": "#/$defs/duration" },
        "retries": { "type": "integer", "minimum": 0 },
        "save_as": { "$ref": "#/$defs/identifier" },

        "set": { "$ref": "#/$defs/setObject" },

        "do": {
          "description": "Nested steps to execute in order (used for grouping and foreach loops).",
          "type": "array",
          "items": { "$ref": "#/$defs/step" }
        },

        "foreach": {
          "description": "Array expression or value to iterate over when executing the nested `do` steps.",
          "oneOf": [
            { "$ref": "#/$defs/expr" },
            { "$ref": "#/$defs/valueOrTemplate" }
          ]
        },
        "as": { "$ref": "#/$defs/identifier" },

        "on_error": {
          "description": "Error handling strategy for this step: fail/continue/skip or nested recovery steps.",
          "oneOf": [
            { "type": "string", "enum": ["fail", "continue", "skip"] },
            {
              "type": "object",
              "additionalProperties": false,
              "properties": {
                "mode": {
                  "type": "string",
                  "enum": ["fail", "continue", "skip"]
                },
                "do": { "type": "array", "items": { "$ref": "#/$defs/step" } }
              },
              "required": ["mode"]
            }
          ]
        }
      },

      "allOf": [
        {
          "if": { "required": ["foreach"] },
          "then": {
            "required": ["do"],
            "properties": { "do": { "minItems": 1 } }
          }
        },
        {
          "if": { "required": ["set"] },
          "then": { "not": { "required": ["call"] } }
        },
        {
          "if": { "required": ["call"] },
          "then": { "not": { "required": ["set"] } }
        }
      ],

      "anyOf": [
        { "required": ["call"] },
        { "required": ["set"] },
        { "required": ["do"] }
      ]
    }
  }
}
