{
  "$schema": "../../../../src/adaos/abi/scenario.schema.json",
  "id": "taiga_ui_demo_scenario",
  "version": "0.1.0",
  "name": "Taiga UI Demo Scenario",
  "type": "desktop",
  "title": "Taiga UI Demo",
  "description": "Control scenario for semantic Web UI and native Taiga tree, collection grid, metric chart, and shared runtime widgets.",
  "depends": [
    "web_desktop_skill",
    "demo_metrics_skill"
  ],
  "ui": {
    "application": {
      "version": "0.1",
      "desktop": {
        "pageSchema": {
          "id": "taiga_ui_demo",
          "title": "Taiga UI Demo",
          "layout": {
            "version": 2,
            "pattern": "workbench",
            "density": "comfortable",
            "contentWidth": "fluid",
            "scroll": "regions",
            "regions": [
              {
                "id": "sidebar",
                "role": "navigation",
                "priority": 80,
                "scroll": "region",
                "presentation": {
                  "wide": "pane",
                  "compact": "drawer"
                },
                "size": {
                  "minPx": 200,
                  "preferredPx": 280,
                  "maxPx": 480
                }
              },
              {
                "id": "main",
                "role": "main",
                "priority": 100,
                "scroll": "page",
                "presentation": {
                  "wide": "pane",
                  "compact": "stack"
                }
              },
              {
                "id": "right",
                "role": "inspector",
                "priority": 60,
                "scroll": "region",
                "presentation": {
                  "wide": "pane",
                  "compact": "sheet"
                },
                "size": {
                  "minPx": 220,
                  "preferredPx": 360,
                  "maxPx": 600
                }
              },
              {
                "id": "bottom",
                "role": "commands",
                "priority": 90,
                "scroll": "page",
                "presentation": {
                  "wide": "pane",
                  "compact": "pane"
                }
              }
            ],
            "interaction": {
              "selection": "single",
              "rowActivation": "open-detail",
              "filters": "inline",
              "actions": "adaptive",
              "detail": "inline"
            }
          },
          "widgets": [
            {
              "id": "demo-launch",
              "type": "input.commandBar",
              "area": "sidebar",
              "title": "Demo",
              "inputs": {
                "buttons": [
                  {
                    "id": "open-demo",
                    "label": "Open Demo Metrics"
                  },
                  {
                    "id": "open-workspace",
                    "label": "Workspace"
                  },
                  {
                    "id": "open-workspace-shell",
                    "label": "Workspace shell"
                  },
                  {
                    "id": "open-operations",
                    "label": "Operations"
                  },
                  {
                    "id": "emit-skill",
                    "label": "Skill event"
                  },
                  {
                    "id": "emit-host",
                    "label": "Host event"
                  }
                ],
                "size": "small"
              },
              "actions": [
                {
                  "on": "click:open-demo",
                  "type": "navigate",
                  "params": {
                    "to": "demo_metrics_skill.demo_metrics_modal",
                    "surface": "modal",
                    "modalId": "demo_metrics_modal"
                  }
                },
                {
                  "on": "click:open-workspace",
                  "type": "openWorkspace",
                  "params": {
                    "modalId": "workspace_manager",
                    "workspaceRef": "workspace:demo_metrics",
                    "entityRef": "scenario:taiga_ui_demo_scenario"
                  }
                },
                {
                  "on": "click:open-workspace-shell",
                  "type": "openWorkspace",
                  "params": {
                    "surfaceRoute": "workspace"
                  }
                },
                {
                  "on": "click:open-operations",
                  "type": "openWorkspace",
                  "params": {
                    "surfaceRoute": "operations"
                  }
                },
                {
                  "on": "click:emit-skill",
                  "type": "callSkill",
                  "target": "demo_metrics_skill.emit_demo_event",
                  "params": {
                    "action_id": "desktop_skill_button",
                    "metric_id": "$state.demo_metrics.selection.metric_id"
                  }
                },
                {
                  "on": "click:emit-host",
                  "type": "callHost",
                  "target": "demo_metrics.host_action",
                  "params": {
                    "action_id": "desktop_host_button",
                    "metric_id": "$state.demo_metrics.selection.metric_id"
                  }
                }
              ]
            },
            {
              "id": "demo-summary",
              "type": "visual.metricTile",
              "area": "main",
              "title": "Summary",
              "dataSource": {
                "kind": "y",
                "path": "data/demo_metrics/summary"
              },
              "actions": [
                {
                  "on": "click:open-demo",
                  "type": "navigate",
                  "params": {
                    "to": "demo_metrics_skill.demo_metrics_modal",
                    "surface": "modal",
                    "modalId": "demo_metrics_modal"
                  }
                },
                {
                  "on": "click:open-workspace",
                  "type": "openWorkspace",
                  "params": {
                    "modalId": "workspace_manager",
                    "workspaceRef": "workspace:demo_metrics",
                    "entityRef": "scenario:taiga_ui_demo_scenario"
                  }
                },
                {
                  "on": "click:open-workspace-shell",
                  "type": "openWorkspace",
                  "params": {
                    "surfaceRoute": "workspace"
                  }
                },
                {
                  "on": "click:open-operations",
                  "type": "openWorkspace",
                  "params": {
                    "surfaceRoute": "operations"
                  }
                },
                {
                  "on": "click:emit-skill",
                  "type": "callSkill",
                  "target": "demo_metrics_skill.emit_demo_event",
                  "params": {
                    "action_id": "summary_skill_button",
                    "metric_id": "$state.demo_metrics.selection.metric_id"
                  }
                },
                {
                  "on": "click:emit-host",
                  "type": "callHost",
                  "target": "demo_metrics.host_action",
                  "params": {
                    "action_id": "summary_host_button",
                    "metric_id": "$state.demo_metrics.selection.metric_id"
                  }
                }
              ]
            },
            {
              "id": "demo-table",
              "type": "ui.table",
              "area": "main",
              "title": "Metrics table",
              "dataSource": {
                "kind": "y",
                "path": "data/demo_metrics/table"
              },
              "inputs": {
                "columns": [
                  {
                    "key": "title",
                    "label": "Metric"
                  },
                  {
                    "key": "status",
                    "label": "Status",
                    "width": "120px"
                  },
                  {
                    "key": "value",
                    "label": "Value",
                    "width": "100px"
                  },
                  {
                    "key": "unit",
                    "label": "Unit",
                    "width": "90px"
                  }
                ],
                "emptyText": "No demo metrics yet"
              },
              "actions": [
                {
                  "on": "select",
                  "type": "callHost",
                  "target": "demo_metrics.selection.changed",
                  "params": {
                    "metric_id": "$event.id"
                  }
                }
              ]
            },
            {
              "id": "demo-taiga-grid",
              "type": "visual.taigaCollectionGrid",
              "area": "main",
              "title": "Taiga collection grid",
              "dataSource": {
                "kind": "y",
                "path": "data/demo_metrics/table"
              },
              "inputs": {
                "stateKey": "demo_metrics.taigaSelection",
                "columns": [
                  {
                    "key": "title",
                    "label": "Metric"
                  },
                  {
                    "key": "status",
                    "label": "Status"
                  },
                  {
                    "key": "value",
                    "label": "Value"
                  },
                  {
                    "key": "unit",
                    "label": "Unit"
                  }
                ],
                "emptyText": "No Taiga grid rows yet"
              }